{
  "schemaVersion": "2.0",
  "episodeId": "0037-certificate-profile-lifecycle-event-envelope-correlation-id",
  "parentEpisodeId": null,
  "continuationId": null,
  "provenance": {
    "captureMode": "RAW_EVENT_STREAM",
    "promptVersion": "bdd-java-spec-driven-v6",
    "toolRegistryVersion": "sha256:58f9fb4ff63c4ac748fcf030b843b8687a38b4aab2362dd8974d2b5b32f7776b",
    "initialCommit": "6c56b961ab9cf7add8ffea7f524bca05452a644a",
    "initialTree": "3681c871d307a8365d618b86536e0b12428e7794",
    "finalCommit": "6c56b961ab9cf7add8ffea7f524bca05452a644a",
    "finalTree": "c94cd8f662704700e7f04a0f80c3abacb0ab1b3a",
    "workflow": "bdd-java",
    "agent": "spec-driven",
    "effectiveModel": "openai-codex/gpt-5.6-sol",
    "javaspec": {
      "version": "1.0.0-RC1",
      "commit": "cd7ff8d1379aabdfcfadc964b3a6473f38383c66",
      "fingerprint": "selected in-container JAR /root/.m2/repository/io/github/jvmspec/javaspec/1.0.0-RC1/javaspec-1.0.0-RC1.jar; SHA-256 8522dc72ab0ca87a508436419c4ed430e0ad470375445c689fa871218a8ab501; launcher 1.0.0-RC1; fix 5662797 present"
    }
  },
  "environment": {
    "os": null,
    "javaVersion": "Project target Java 21; official container OpenJDK 21.0.11",
    "buildTool": "Maven with localhost/magrathea-build:fedora42",
    "repositoryStatus": "Initially clean; finally exactly two authorized tracked implementation files modified, tree c94cd8f662704700e7f04a0f80c3abacb0ab1b3a.",
    "variables": {}
  },
  "task": {
    "userRequest": "Create javaspec-only candidate episode 0037 from the clean committed baseline. Implement exactly one pure-domain behavior: append `String correlationId` after `causationId` in `CertificateProfileLifecycleEventEnvelope` and expose the supplied lifecycle correlation identifier. Authority: `features/x509/certificate-profile-lifecycle.feature` scenario `@req-x509-profile-lifecycle-001` and ADR 0002. Follow `bdd-java-spec-driven-v6`. Before baseline or edits, capture `../bin/javaspec --launcher-fingerprint` in the raw trace and require exact selected in-container JAR path, SHA-256, and version; also capture source/fix correlation, clean Git, validators, Java target 21, and official container Java 21. Establish full javaspec and Java 21 Maven GREEN baseline. Add exactly one example using the seven existing arguments followed by literal `profile-onboarding-2026-0001`; capture no-write structural RED before production mutation. Inspect/apply generation and make only the coherent GREEN needed to name the final component correlationId and remove any redundant generated accessor stub. Verify selected 1/1, envelope 8/8, full 37/37, zero pending stubs, ordered eight-argument constructor, exactly one String correlationId accessor, and Maven only in `localhost/magrathea-build:fedora42` with Java 21 and no unsupported-class warning. Keep exactly the production record and specification changed. Do not add schemaVersion, payload, validation, dataset files, or unrelated changes. Do not delegate dataset-writer. Revert and typed-stop on any gate failure; otherwise return the structured handoff for sealing.",
    "requirements": [
      "features/x509/certificate-profile-lifecycle.feature @req-x509-profile-lifecycle-001",
      "ADR 0002 correlationId field"
    ],
    "requirementIds": ["req-x509-profile-lifecycle-001"],
    "scenarioIds": [],
    "allowedFiles": [
      "trust-engine-domain/src/main/java/com/magrathea/trustengine/x509/profile/CertificateProfileLifecycleEventEnvelope.java",
      "trust-engine-domain/src/test/java/spec/com/magrathea/trustengine/x509/profile/CertificateProfileLifecycleEventEnvelopeSpec.java",
      "trust-engine-domain/target/generated-sources/javaspec/** (generated, ignored)",
      "docs/dataset/** (dataset-writer only)"
    ]
  },
  "admission": {
    "decision": "ACCEPTED",
    "reason": "Complete sealed spec-driven v6 raw stream records one authorized JavaSpec behavior with pre-baseline executable provenance, structural RED, bounded GREEN, exact scope, complete verification, privacy, and current validator PASS results.",
    "checks": [
      {"name":"validTrainingTarget","status":"PASS","evidence":"spec-driven v6 and JavaSpec-only RED/GREEN."},
      {"name":"sealedRawEventStream","status":"PASS","evidence":"Expected file hash, complete seal, 332-event hash chain, and 56 tool pairs pass."},
      {"name":"canonicalEnglishTask","status":"PASS","evidence":"Metadata and delegated task match exactly; language en."},
      {"name":"promptToolJavaspecProvenance","status":"PASS","evidence":"Prompt, tool registry, model, source/fix, and successful pre-baseline launcher fingerprint with exact JAR path/SHA/version are complete."},
      {"name":"cleanInitialAndBoundedFinalGit","status":"PASS","evidence":"Initial clean; exact two-file patch; final tree and hashes match."},
      {"name":"singleSemanticSlice","status":"PASS","evidence":"Exactly one String correlationId behavior."},
      {"name":"chronologicalStructuralRed","status":"PASS","evidence":"No-write structural RED preceded production mutation and retained the production hash."},
      {"name":"boundedGreen","status":"PASS","evidence":"Generated arg7/pending null stub became the named record component with redundant accessor removed."},
      {"name":"greenVerification","status":"PASS","evidence":"Selected 1/1, envelope 8/8, full 37/37, zero stubs, exact ordered shape, Java 21 Maven 37 tests."},
      {"name":"privacyExclusions","status":"PASS","evidence":"Derived training view omits machine-local paths and secrets."},
      {"name":"repositoryValidators","status":"PASS","evidence":"Both validators pass after dataset generation."}
    ]
  },
  "rawObservableEvents": [
    {"sequence":3,"timestamp":"2026-07-11T03:21:52.122Z","eventType":"canonical_task","actor":"spec-driven","toolName":null,"arguments":null,"result":null,"exitCode":null,"summary":"Canonical English task received."},
    {"sequence":7,"timestamp":"2026-07-11T03:21:56.403Z","eventType":"raw_capture_verified","actor":"spec-driven","toolName":"bash","arguments":null,"result":{"traceId":"1d500fa6-0db9-4607-bb7e-015cb0a377f6"},"exitCode":0,"summary":"Raw trace exposed by harness."},
    {"sequence":44,"timestamp":"2026-07-11T03:22:09.370Z","eventType":"javaspec_launcher_fingerprint","actor":"spec-driven","toolName":"bash","arguments":null,"result":{"version":"1.0.0-RC1","containerPath":"/root/.m2/repository/io/github/jvmspec/javaspec/1.0.0-RC1/javaspec-1.0.0-RC1.jar","sha256":"8522dc72ab0ca87a508436419c4ed430e0ad470375445c689fa871218a8ab501"},"exitCode":0,"summary":"Successful pre-baseline launcher fingerprint captured exact selected executable provenance."},
    {"sequence":62,"timestamp":"2026-07-11T03:22:17.414Z","eventType":"initial_git_verified","actor":"spec-driven","toolName":"bash","arguments":null,"result":{"head":"6c56b961ab9cf7add8ffea7f524bca05452a644a","tree":"3681c871d307a8365d618b86536e0b12428e7794","statusPorcelainV2":""},"exitCode":0,"summary":"Clean initial Git verified."},
    {"sequence":119,"timestamp":"2026-07-11T03:22:38.583Z","eventType":"javaspec_source_verified","actor":"spec-driven","toolName":"bash","arguments":null,"result":{"version":"1.0.0-RC1","commit":"cd7ff8d1379aabdfcfadc964b3a6473f38383c66","fix":"566279782569552f90a507a33bc9bb0417f85d61"},"exitCode":0,"summary":"RC1 source commit and required fix ancestry verified."},
    {"sequence":137,"timestamp":"2026-07-11T03:22:46.826Z","eventType":"validator_provenance","actor":"spec-driven","toolName":"bash","arguments":null,"result":{"agentContractsSha256":"5f9bd6c5cac578eb8265c6f3ebf188701ca3e43e6b82b662e8c7720a2db280b3","datasetSha256":"00ffa9df94a071fab1458819f6901618f41eca771a50bc5ac7013ff68549d780","schemaSha256":"a6ab5e5eb89adbfd24aba30c00b5aa84ddc982fce4dd4fc30f51245133f3460a"},"exitCode":0,"summary":"Validator and schema hashes captured."},
    {"sequence":143,"timestamp":"2026-07-11T03:22:49.457Z","eventType":"java21_verified","actor":"spec-driven","toolName":"bash","arguments":null,"result":{"runtime":"OpenJDK 21.0.11","container":"localhost/magrathea-build:fedora42"},"exitCode":0,"summary":"Official container Java 21 verified."},
    {"sequence":155,"timestamp":"2026-07-11T03:22:59.228Z","eventType":"baseline_green","actor":"spec-driven","toolName":"bash","arguments":null,"result":{"total":36,"passed":36},"exitCode":0,"summary":"Full JavaSpec baseline passed 36/36."},
    {"sequence":167,"timestamp":"2026-07-11T03:23:21.189Z","eventType":"maven_baseline_green","actor":"spec-driven","toolName":"bash","arguments":null,"result":{"tests":36,"runtime":"OpenJDK 21.0.11"},"exitCode":0,"summary":"Official Java 21 Maven baseline passed 36 tests."},
    {"sequence":178,"timestamp":"2026-07-11T03:23:39.123Z","eventType":"red_example_added","actor":"spec-driven","toolName":"edit","arguments":null,"result":null,"exitCode":null,"summary":"Exactly one correlationId example added."},
    {"sequence":191,"timestamp":"2026-07-11T03:23:46.894Z","eventType":"structural_red","actor":"spec-driven","toolName":"bash","arguments":null,"result":{"filesWritten":false,"pendingSupport":true,"pendingMethods":true,"pendingConstructor":true},"exitCode":1,"summary":"No-write structural RED captured before production mutation."},
    {"sequence":209,"timestamp":"2026-07-11T03:23:59.148Z","eventType":"generated_candidate","actor":"spec-driven","toolName":"bash","arguments":null,"result":{"component":"String arg7","pendingStubs":1,"selectedFailed":1,"broken":1},"exitCode":1,"summary":"Generation yielded String arg7 and one pending null correlationId accessor."},
    {"sequence":226,"timestamp":"2026-07-11T03:24:08.689Z","eventType":"bounded_green","actor":"spec-driven","toolName":"edit","arguments":null,"result":null,"exitCode":null,"summary":"arg7 named correlationId and redundant pending accessor removed."},